FALSE,49,CHECK-IN,,"This week, our hearts resonated with profound truths: God's unwavering love, the deliverance through Jesus Christ, and the eternal symphony of gratitude. From the quiet acknowledgments in the stillness of our hearts to the boisterous celebrations that echo far and wide, gratitude is our life's undercurrent, a force that shapes our interactions, decisions, and perceptions.

The scriptures unfurl a panorama, one where gratitude isn't just a personal emotion but a collective experience. Nehemiah's story paints a vivid picture of a community rejoicing amidst ruins, a testament to collective resilience and faith. The Psalmist's call to eternal praise underscores the cyclical nature of thanksgiving, a melody that transcends time, binding generations.

Yet, at the heart of this vast panorama, lies a simple, poignant truth: gratitude begins with recognizing God's boundless love and His wonderful deeds. It's in this recognition that our hearts find the rhythm to join the eternal symphony of praise.",,"As you step into the forthcoming week, let each day be a canvas waiting to be painted with hues of gratitude. Embrace the moments, both triumphant and trying, for each holds a nugget of God's goodness. Challenge yourself: can you find the melody of thanksgiving amidst the cacophony of life's challenges?

And here's a call to action: Share your stories. The tales of God's love and mercy aren't meant for solitary consumption. They are the legacy we pass on, the notes in the symphony that inspire others to join in. Whether it's recounting a past miracle or sharing today's blessings with a friend, let your gratitude reverberate, creating ripples that touch souls and transform hearts.

Embrace the week with a spirit poised for discovery and proclamation. Dive deep into the reservoirs of gratitude, and you'll find that every drop adds to the vast ocean of God's love. Onward, fellow pilgrim, for a week awash with gratitude holds revelations aplenty."
TRUE,50,Jeremiah 33:11,"The sounds of joy and gladness, the voices of bride and bridegroom, and the voices of those who bring thank offerings to the house of the LORD, saying,
“Give thanks to the LORD Almighty,
for the LORD is good;
his love endures forever.”
For I will restore the fortunes of the land as they were before, ’ says the LORD.        ","Jeremiah 33:11, nestled within a promise of restoration, speaks to the profound power of God to bring renewal and joy out of desolation. This verse paints a vivid picture of transformation, where God’s restoration touches not only the physical and external but reaches deep into the soul. Restoration, as seen in the Bible, is about God bringing us back, even to a state we may have never known, especially in the context of our spiritual lives. The joy spoken of here, tied to the restoration of fortunes, is the joy of salvation, a return to the purity and righteousness we were meant to experience before the fall. It's a celebration of what God has done and continues to do in bringing us back to Himself, restoring us as His children and coheirs with Christ.","Reflect on the “fortunes” in your life that may need God’s touch of restoration. What aspects of your life, whether physical, emotional, or spiritual, are you hoping to see renewed? And as you ponder this, think also of the areas where God has already worked His restorative power. How has His intervention brought about “sounds of joy and gladness” in your life? In your journey of faith, consider the moments where the joy of the Lord became evident, especially after times of spiritual renewal or deepening understanding of your salvation in Christ.","As you reflect on your day, consider the instances where you experienced or witnessed restoration. Did moments arise where you felt a renewed sense of joy, perhaps reminiscent of the joy of salvation? Think about instances from your life or your surroundings where the transformative hand of God was evident, leading to joy and gladness. Reflect on how these moments of restoration and the accompanying joy speak to the continuous, life-changing work of God in your life and in the lives of those around you."
TRUE,51,Psalm 111:1,"Praise the LORD.
I will extol the LORD with all my heart
in the council of the upright and in the assembly.","Picture this: a room filled with individuals, each with their stories, dreams, and battles. And in the midst of it all, a voice rises - fervent, unwavering, and wholehearted. That voice chooses to extol the LORD, not just in the secrecy of personal prayer, but loudly, publicly, and with utmost sincerity. This isn't a casual nod to the Divine, but a heartfelt proclamation of His greatness. It's a challenge to each of us. How often do we take our praise public? How frequently do we, in the midst of our busy lives, the meetings, and the assemblies, pause to extol the LORD with all our heart?","Think about the moments when you've felt an overwhelming urge to praise God, not just in the quiet of your room but amidst a gathering. What sparked that urge? Was it a miraculous intervention, a simple blessing, or perhaps the beauty of nature around you? Dig into those memories. What are the key instances you recall where gratitude spilled over into public praise?","As twilight gives way to night, think about your day. Were there moments when your heart swelled with gratitude? Maybe it was a kind gesture, a word of encouragement, or just the simple pleasure of a task well done. Jot down moments from the day that made you want to pause, look up, and simply say, ""Praise the LORD""."
TRUE,52,Ephesians 5:4,"Nor should there be obscenity, foolish talk or coarse joking, which are out of place, but rather thanksgiving.","In a world where conversations can swiftly devolve into negativity, where careless words and jests are often thrown around without thought, Paul's reminder in Ephesians is strikingly relevant. We are called to be different. Not just by avoiding the negative, but by actively choosing the positive. Instead of getting lost in the noise of obscenity or idle chatter, we have a higher calling: Thanksgiving. It's not just about what we refrain from saying; it's about what we choose to voice. Gratitude, when spoken, has the power to change atmospheres, uplift spirits, and reframe perspectives. So, why not let our words be a beacon of light, echoing our heart's thanksgiving?","Reflect upon recent conversations you've had. Were there moments when you could've chosen gratitude over negativity, encouragement over criticism, or praise over sarcasm? Dive deep and identify specific instances where you could've turned the tide with words of thanksgiving. How would those conversations have changed?","As you wind down, think about the words you've shared today. Were there moments of genuine gratitude? Instances where your words uplifted someone or painted a picture of hope? List down conversations or moments from today where thanksgiving shone through or where you wish it had. Remember, each day is a chance to choose gratitude over grievance."
TRUE,53,Psalm 86:12,"I will praise you, Lord my God, with all my heart;
I will glorify your name forever.	","Imagine, for a moment, the vast expanse of eternity. Time, as we know it, ceases, and yet, the Psalmist makes a promise: to glorify God's name forever. That's the depth of gratitude and commitment we're talking about here. It's not fleeting, not merely a passing emotion. It's an unwavering declaration, a dedication that transcends time and circumstance. The Psalmist's heart isn't divided or distracted; it's wholly immersed in praise. This is a reminder and an invitation for us: to live with such profound gratitude that our praise resonates not just in the present but echoes into eternity.","Consider your personal journey with God. Are there defining moments where you've felt an overwhelming desire to praise Him with all your heart? Identify moments where your gratitude felt timeless, as if you could continue to glorify Him forever. What sparked that deep-seated thankfulness?","As twilight blankets the world around you, recall any challenges or struggles you faced. How did you choose gratitude and praise despite difficulties? List the instances where you still glorified God amidst adversity."
TRUE,54,Nehemiah 12:27,"At the dedication of the wall of Jerusalem, the Levites were sought out from where they lived and were brought to Jerusalem to celebrate joyfully the dedication with songs of thanksgiving and with the music of cymbals, harps and lyres.","Picture the scene: A once broken and battered wall now stands restored in Jerusalem. This isn't just about bricks and mortar; it's a symbol of renewed hope, resilience, and God's providence. The Levites didn't just casually stroll in; they were intentionally sought out, called upon to lead the celebrations. Why? Because gratitude, in its most profound form, isn't silent. It resonates, vibrates, and reverberates. The air was thick not just with melodies, but with deep-seated thankfulness. It's a call to action for us. When we witness restoration, revival, and God's handiwork, our response shouldn't be muted. It should be a joyful, resounding chorus of gratitude.","Reflect on a moment in your life where there was a 'dedication' or a significant turning point that marked a renewal or restoration. How did you celebrate that moment? Was it with silent reflection, or did you, like the Levites, make your gratitude heard? Search into that memory and jot down the emotions and the reasons for your thankfulness.","As today draws to an end, think of the walls in your life. Not just the physical barriers but the emotional and spiritual ones as well. Have there been moments today, subtle or significant, where you've felt a sense of repair or rejuvenation? Perhaps a mended relationship, a renewed sense of purpose, or even a simple restoration of peace after a hectic day. Identify and cherish such moments of gratitude. Let them serve as a testament to God's continuous work in your life."
TRUE,55,Psalm 103:2,"Praise the LORD, my soul,
and forget not all his benefits","What a wake-up call this verse is. It's a raw, passionate rallying cry from David, imploring his soul to bless the Lord and remember His benefits. And there's something here about memory, isn't there? It's easy to forget, easy to let the small miracles of our everyday lives fade into the background noise. But this verse is an invitation to be intentional, to remember, to actively recall the benefits and blessings that come from God. It's not just about expressing gratitude; it's about intentionally cultivating a memory for thankfulness.","Imagine your memory as a gratitude gallery. Every moment of appreciation and thanksgiving is a beautiful painting on its walls. You might have some masterpieces that get a lot of attention. But let's look for those less obvious, maybe even overlooked, 'paintings' in the gallery. Can you think of any times or experiences you haven't thought about in a while that, upon reflection, really demonstrate God's blessings?","The day is winding down, the world is settling into a hush. And in this quiet moment, let's unearth the hidden gems. What are three moments from your day that sparked a smile, a moment of peace, a surge of gratitude? Capture these slices of joy here, and let them be your lullaby tonight."
FALSE,56,CHECK-IN,,"This week, we journeyed through the vibrant tapestry of gratitude. From the jubilant celebrations of a restored Jerusalem to the deeply personal heart cry of David, we witnessed the myriad ways our souls can resonate with thanksgiving. It's evident: Gratitude isn't a passive emotion; it's an active choice. It's a decision to remember, to cherish, and to celebrate the ""benefits"" God bestows upon us, both the monumental and the mundane.

Jeremiah's promise of restoration and joy in a city once riddled with despair serves as a poignant reminder: no matter the depth of our valleys, the peaks of joy and songs of gratitude await. Nehemiah's dedication of the wall wasn't just about a structure; it was about community, unity, and a collective song of thanks. And amidst these collective tales stands David's intimate plea: a call to never forget, to always remember the myriad blessings that flow from above.",,"As you step into the new week, challenge yourself to be a curator of gratitude. Create your own ""gallery"" as David might have, filled with memories, moments, and blessings that deserve to be cherished. Actively seek out reasons to be thankful, even in the most unexpected places.

But also, remember: gratitude isn't meant to be hoarded; it's meant to be shared. Like the Levites leading the celebrations, let your gratitude be heard, seen, and felt. Share your stories, paint your moments of thanksgiving, and invite others into your gallery. For in sharing, we not only amplify our own joy but inspire it in others.

Embrace the week with eyes wide open to the blessings around you. May every moment, every interaction, and every challenge be an opportunity to add to your ever-growing tapestry of thanksgiving. Onward, fellow traveller, for a week drenched in gratitude awaits."
TRUE,57,Matthew 11:25,"At that time Jesus said, “I praise you, Father, Lord of heaven and earth, because you have hidden these things from the wise and learned, and revealed them to little children.","Amidst a world that often values intellect, prestige, and knowledge, Jesus flips the script. He praises the Father for revealing profound truths not to the scholars or the philosophers, but to the innocent, the curious, the untainted – the little children. There's a profound simplicity in faith, one that often gets overlooked in our quest for deeper understanding. Jesus' words invite us to appreciate the spiritual insights and unburdened faith of children, reminding us that sometimes, to truly grasp the mysteries of the kingdom, we need to adopt their childlike wonder and simplicity. This is an invitation to learn from the children around us, whether they are our own, those we teach, or those we encounter, and to recognize the value of their pure, uncomplicated approach to faith.","Think about the children in your life – your own, those you teach, or young ones you know. Firstly, express your thankfulness for each one. Secondly, think about the times they have expressed their understanding of God or their faith. What can you learn from their simple yet profound approach to knowing God? Are there instances where their innocent faith and understanding brought a new perspective or a fresh revelation to you? How does their childlike faith inspire gratitude in you, and how can it guide you to approach God with a similar simplicity and trust?","As today concludes, consider times when you overcomplicated a situation instead of embracing childlike faith and gratitude. Reflect on instances where adult complexities clouded your perspective – perhaps in decision-making, where logic overshadowed faith, or in moments of stress, where worry took precedence over simple trust. How often have you found yourself analyzing every possible outcome instead of resting in God's assurance? Or times when you've let cynicism or skepticism diminish the joy and wonder of faith? Consider circumstances where you relied more on your own understanding and control, rather than embracing the uncomplicated, trusting approach of thanking God with the simplicity and sincerity of a child's heart.
"
TRUE,58,"Psalms 105:3,4","Glory in his holy name; let the hearts of those who seek the LORD rejoice.Look to the LORD and his strength;
seek his face always.","To glory in His name is not a fleeting act of admiration but a deep-rooted celebration of His very essence. The Psalmist doesn't just suggest it; he urges it, underscoring the transformative power of truly seeking the LORD. It's not a passive act but a proactive pursuit, one that promises strength, direction, and joy. In a world where distractions are aplenty, the call is clear: Look to the LORD. Continuously. Persistently. Not just when times are tough or when we need a favour, but in every moment, every situation, every breath. Because in His presence, true rejoicing is found.","Remember a time when, amidst the chaos and noise, you intentionally sought the LORD's presence and found strength in it. What led you to that moment? And in that seeking, what did you discover about Him and yourself? Jot down these revelations and the feelings of gratitude they evoke.","Another day is folding into the tapestry of your life. And here you are, holding the threads of your story, each one a testament to God's grace. As you look back, what are those moments that make your heart sing a song of gratitude? Don't let them fade into the white noise of your routine. Capture them here.	"
TRUE,59,Jonah 2:9,"But I, with shouts of grateful praise, will sacrifice to you. What I have vowed I will make good. I will say, 'Salvation comes from the LORD.'","Here's a little moment of truth from Jonah. He's in the belly of a fish; things aren't looking too bright. And yet, in this place of despair and distress, he chooses to offer shouts of grateful praise. Because gratitude isn't just for the sunny days and the mountaintop experiences. It's also for the belly-of-the-fish moments, when you realise that salvation comes from the Lord.		","Today, ponder on your own belly-of-the-fish moments. Times when things didn't look too promising, yet you found a reason to be grateful. What are some of your experiences where you found gratitude in the midst of difficulty?","Another day is folding into the tapestry of your life. And here you are, holding the threads of your story, each one a testament to God's grace. As you look back, what are three moments that make your heart sing a song of gratitude? Don't let them fade into the white noise of your routine. Capture them here.	
	"
TRUE,60,Psalm 7:17,"I will give thanks to the LORD because of his righteousness;
I will sing the praises of the name of the LORD Most High.","The essence of gratitude is often found in recognising something beyond ourselves, something larger, more powerful, and infinitely righteous. The Psalmist here acknowledges a profound truth: that the foundation of our thanks is rooted in the unwavering righteousness of the LORD. Righteousness is the divine attribute of perfect moral integrity and justice, an unwavering commitment to what is pure and right. It's not based on fleeting emotions or circumstantial evidence. Righteousness is the unchanging nature of God, and it beckons a response - not just a whispered 'thank you' but an exuberant song of praise. When we truly grasp the depth of His righteousness, our hearts cannot help but sing.  ","Consider this very moment—how does the righteousness of God manifest in your immediate surroundings, your current thoughts, or the beat of your heart? As you draw breath right now, let your awareness rest on His steadfast justice, His unchanging love. How does this recognition shape your gratitude today? What song of gratitude is stirring within you at this instant?","As the shadows lengthen and the world quiets, take a moment to reflect on the melodies of gratitude that have played in your heart today. Were there instances where you were reminded of the LORD's righteousness? Perhaps a fleeting moment or a profound realisation? Jot down these instances, these songs of the soul, and let them be a testament to the ongoing symphony of praise in your life."
TRUE,61,Romans 1:8,"First, I thank my God through Jesus Christ for all of you, because your faith is being reported all over the world.","Paul, in his letter to the Romans, starts with a tone of genuine gratitude. Amidst his vast missionary journeys and amidst the challenges he faced, he found a moment to express his thankfulness for the faith of the Roman believers. It wasn’t a trivial faith; it was the kind that made headlines, that travelled through whispered stories and awe-filled accounts. It's a reminder that our faith, when genuine and strong, doesn't just stay with us. It radiates, it influences, it becomes a beacon for others and a source of joy for those who have sown into our spiritual journey.","Envision a world where your faith is not just a personal journey but a luminous beacon, guiding and inspiring others. First, turn your thoughts to gratitude for the ways your own faith might be silently illuminating paths for those around you. In what ways have your trust, perseverance, and love been a testament to God’s work in your life? Now, shift your focus outward. Thank God for those stalwarts of faith in your life, whose unwavering belief has been a source of inspiration and strength for you. Reflect on the synergistic symphony of faith – how your faith journey impacts others and how theirs fortifies you.","As the curtain of night draws close, consider the reciprocal nature of faith in your life. Where did you see your faith ripple out and touch others today? Were there moments where the faith of someone else uplifted or challenged you? Reflect on these dual roles – being both a recipient and a giver of faith-inspired encouragement. Note down instances from today that underscore this beautiful exchange, and let gratitude swell in your heart for the shared journey of faith that connects us all."
TRUE,62,Psalm 56:12,"I am under vows to you, my God;
I will present my thank offerings to you.        ","In Psalm 56:12, we delve into the heart of a deeper truth: gratitude in Christianity transcends mere emotion. While emotions often guide us towards a feeling of thankfulness, our gratitude stands on firmer ground – the covenant we have with God. This psalm encapsulates the essence of covenant-based gratitude. It’s an understanding that our thanksgiving to God is not just an emotional response but a fulfilment of our vows, a testament to our relationship with Him. It’s an acknowledgement that even when emotions ebb and flow, our commitment to express gratitude remains steadfast. Like the psalmist, we are invited to realise that our thanksgiving offerings are not just borne out of the immediate feelings of joy or relief but are rooted in the unchanging covenant we share with God.","Reflect on your own covenant with God, the foundational promises that underpin your faith journey. How does this covenantal relationship shape your expression of gratitude? It’s not always about waiting for the right emotion to strike. Sometimes, it's about choosing to thank God as an act of fidelity to your vows, trusting that the emotional depth will follow. What are the ways, both big and small, you can demonstrate this covenant-based gratitude today? Think beyond feelings and consider actions that embody your commitment to God.","As day turns to dusk, contemplate how you upheld your part of the covenant with God today. Were there moments where, despite your emotional state, you chose to express gratitude as a reflection of your vows? It might be in the discipline of prayer, in acts of kindness, or in moments of quiet acknowledgement of His presence. Reflect on these instances, recognising how your gratitude, rooted in covenant rather than just emotion, brings a different dimension to your spiritual walk."
FALSE,63,CHECK-IN,,"This week, our journey through Scripture has woven a tapestry of gratitude that spans from the intimate corridors of personal conviction to the vast expanses of global faith communities. Whether it's Jesus praising the Father for revealing truths to the innocent or Paul's heartfelt gratitude for the globally reported faith of the Romans, we've been reminded of the profound impact of thankfulness.

From the Psalmist's commitment to offering tangible thanks to Jonah's deep-seated gratitude even from the belly of a fish, we've seen that gratitude isn't confined to our circumstances. It transcends them. It's about recognising God's righteousness, as highlighted in Psalm 7:17, and letting that recognition birth a song of praise from the depths of our souls. It's about making promises in moments of divine clarity and then honouring them, as the Psalmist does in Psalm 56:12. It's about acknowledging that our faith isn't just a personal affair; it's a light that shines, impacts, and inspires, as Paul notes about the Romans.",,"As we step into the next week, let's be purposeful in our gratitude. Let's remember that our thanksgiving has ripples, influencing not just our own spirits but those around us. Challenge yourself to see the world with a childlike wonder, as Jesus encourages us, unburdened by over-analysis yet profound in its simplicity.

Seek out moments to vocalise your gratitude, not just to God but to those around you. As Paul did with the Romans, let's affirm and celebrate the faith journeys of our peers. And in the still moments, when the world fades and it's just you and God, honour the vows of your heart, those silent promises made in whispers of prayer.

Approach each day with the intention to not just feel but show gratitude. For in the doing, in the showing, we truly embrace the transformative power of thanksgiving. Embrace the week with a spirit of expectancy, knowing that each moment holds the promise of revelation, restoration, and rejoicing. Onward, fellow traveller, for a week rich in gratitude and discovery awaits."
